{
  "$schema": "https://json-schema.org/draft/2020-12/schema",
  "$id": "https://typotypocasual.victroyarroyo.workers.dev/data.schema.json",
  "title": "typocasual site data",
  "description": "Contract for static/data.json. This file is the single source of truth for the front page: the six typeface frames and the outbound link cards. scripts/check.mjs validates data.json against it and runs before every deploy.",
  "type": "object",
  "required": ["frames", "links"],
  "properties": {
    "$schema": {
      "type": "string",
      "description": "Points editors and agents at this schema for validation and autocomplete."
    },

    "framesHead": {
      "type": "object",
      "description": "Heading above the frame grid.",
      "properties": {
        "title": { "type": "string" },
        "blurb": { "type": "string" }
      }
    },

    "frames": {
      "type": "array",
      "description": "One frame per typeface. The frame count is the face count.",
      "minItems": 1,
      "items": { "$ref": "#/$defs/frame" }
    },

    "linksHead": {
      "type": "object",
      "description": "Heading above the outbound link cards.",
      "properties": {
        "title": { "type": "string" },
        "blurb": { "type": "string" }
      }
    },

    "links": {
      "type": "array",
      "description": "Outbound links, rendered as preview cards.",
      "items": { "$ref": "#/$defs/link" }
    }
  },

  "$defs": {
    "frame": {
      "type": "object",
      "description": "One typeface. The specimen is set live in the browser, so the reader sees the real face, not an image of it.",
      "required": ["role", "name", "sample", "specimen", "stack", "why", "used"],
      "properties": {
        "role": {
          "type": "string",
          "minLength": 1,
          "description": "The job this face does. Must be unique across frames."
        },
        "name": {
          "type": "string",
          "minLength": 1,
          "description": "The family name. Must match the first family in `stack`, and must be loaded by the fonts link in layouts/partials/head.html."
        },
        "weights": {
          "type": "string",
          "description": "Human-readable weight range, e.g. \"400–900 · variable\"."
        },
        "sample": {
          "type": "string",
          "minLength": 1,
          "description": "The large glyphs, e.g. \"Aa\"."
        },
        "specimen": {
          "type": "string",
          "minLength": 1,
          "description": "The sample line, set in the face."
        },
        "stack": {
          "type": "string",
          "minLength": 1,
          "description": "A CSS font-family value, e.g. \"\\\"Lora\\\", Georgia, serif\"."
        },
        "weight": {
          "type": "number",
          "minimum": 100,
          "maximum": 1000,
          "description": "Font weight for the specimen."
        },
        "why": {
          "type": "string",
          "minLength": 1,
          "description": "Why this face, in one sentence."
        },
        "used": {
          "type": "string",
          "minLength": 1,
          "description": "Where it appears on the site."
        }
      }
    },

    "link": {
      "type": "object",
      "description": "One outbound link card. The domain label and the favicon are derived from `url`.",
      "required": ["title", "url", "desc"],
      "properties": {
        "title": { "type": "string", "minLength": 1 },
        "url": {
          "type": "string",
          "pattern": "^https://",
          "description": "Must be absolute and https."
        },
        "handle": { "type": "string", "description": "Secondary line, e.g. \"@veekdur\"." },
        "desc": { "type": "string", "minLength": 1 }
      }
    }
  }
}
