{
  "$schema": "./data.schema.json",

  "framesHead": {
    "title": "The type",
    "blurb": "Six faces. Each one has a job, and this is the job."
  },

  "frames": [
    {
      "role": "Display",
      "name": "Epilogue",
      "weights": "400–900 · variable",
      "sample": "Aa",
      "specimen": "typocasual",
      "stack": "\"Epilogue\", system-ui, sans-serif",
      "weight": 900,
      "why": "The only face here set heavy enough to hold a wall up.",
      "used": "The logotype. Nowhere else."
    },
    {
      "role": "Interface",
      "name": "Fira Sans",
      "weights": "100–900 · variable",
      "sample": "Aa",
      "specimen": "Frames · Essays · Sunlit",
      "stack": "\"Fira Sans\", system-ui, sans-serif",
      "weight": 500,
      "why": "Drawn for small screen text. It stays legible at the size labels actually are.",
      "used": "The top rail, labels, buttons."
    },
    {
      "role": "Heading",
      "name": "Lora",
      "weights": "400–700 · variable",
      "sample": "Rg",
      "specimen": "constant growth and decay",
      "stack": "\"Lora\", Georgia, serif",
      "weight": 700,
      "why": "A serif set against all that grey. Gives the structure a voice that is not shouting.",
      "used": "Page titles, essay titles, blockquotes."
    },
    {
      "role": "Standfirst",
      "name": "Lexend Deca",
      "weights": "100–900 · variable",
      "sample": "Se",
      "specimen": "A place of constant growth and decay.",
      "stack": "\"Lexend Deca\", system-ui, sans-serif",
      "weight": 400,
      "why": "Designed for reading proficiency, so it carries the line directly under a title.",
      "used": "Standfirsts and pull quotes."
    },
    {
      "role": "Reading",
      "name": "Atkinson Hyperlegible Next",
      "weights": "200–800 · variable",
      "sample": "Se",
      "specimen": "Readable is the whole point.",
      "stack": "\"Atkinson Hyperlegible Next\", system-ui, sans-serif",
      "weight": 400,
      "why": "Shapes drawn apart from each other on purpose, so long text does not fatigue.",
      "used": "All body copy, here and in the essays."
    },
    {
      "role": "Mono",
      "name": "Atkinson Hyperlegible Mono",
      "weights": "200–700 · variable",
      "sample": "01",
      "specimen": "FRAME 06 OF 06",
      "stack": "\"Atkinson Hyperlegible Mono\", ui-monospace, monospace",
      "weight": 600,
      "why": "Fixed width, so numbers and frame labels line up without effort.",
      "used": "Captions, dates, frame numbers, code."
    }
  ],

  "linksHead": {
    "title": "Elsewhere",
    "blurb": "Where the rest of it lives."
  },

  "links": [
    {
      "title": "GitHub",
      "url": "https://github.com/veekdur",
      "handle": "@veekdur",
      "desc": "Code, tools, and experiments that got further than the kanban did."
    },
    {
      "title": "Pika",
      "url": "https://typocasual.pika.page",
      "handle": "typocasual.pika.page",
      "desc": "The blog. Mostly dormant, occasionally not."
    },
    {
      "title": "Letterbird",
      "url": "https://letterbird.co/talktovictor",
      "handle": "talktovictor",
      "desc": "Send me something. Email, or anything shaped like it."
    }
  ]
}
